<?xml version="1.0" encoding="UTF-8"?>
<curriculum xmlns:xsi="http://www.w3.org/2001/XMLSchema-instance" xsi:noNamespaceSchemaLocation="Report.xsd">

    <reports>
        <report>
            <studentID>1</studentID>
            <programID>1</programID>
            <courseID>1</courseID>
            <taskID>1</taskID>
            <mark>5</mark>
            <status>изучение завершено</status>
        </report>
        <report>
            <studentID>1</studentID>
            <programID>1</programID>
            <courseID>2</courseID>
            <taskID>2</taskID>
            <mark>4</mark>
            <status>изучение завершено</status>
        </report>
        <report>
            <studentID>1</studentID>
            <programID>1</programID>
            <courseID>2</courseID>
            <taskID>3</taskID>
            <mark>3</mark>
            <status>задание принято</status>
        </report>
        <report>
            <studentID>1</studentID>
            <programID>1</programID>
            <courseID>3</courseID>
            <taskID>4</taskID>
            <mark>3</mark>
            <status>изучение завершено</status>
        </report>
        <report>
            <studentID>1</studentID>
            <programID>1</programID>
            <courseID>3</courseID>
            <taskID>5</taskID>
            <mark>3</mark>
            <status>задание принято</status>
        </report>
        <report>
            <studentID>1</studentID>
            <programID>1</programID>
            <courseID>4</courseID>
            <taskID>6</taskID>
            <mark>5</mark>
            <status>изучение завершено</status>
        </report>
        <report>
            <studentID>1</studentID>
            <programID>1</programID>
            <courseID>4</courseID>
            <taskID>7</taskID>
            <mark>5</mark>
            <status>задание принято</status>
        </report>
        <report>
            <studentID>1</studentID>
            <programID>1</programID>
            <courseID>5</courseID>
            <taskID>8</taskID>
            <mark>5</mark>
            <status>изучение завершено</status>
        </report>
        <report>
            <studentID>1</studentID>
            <programID>1</programID>
            <courseID>5</courseID>
            <taskID>9</taskID>
            <mark>5</mark>
            <status>задание принято</status>
        </report>
        <report>
            <studentID>1</studentID>
            <programID>1</programID>
            <courseID>6</courseID>
            <taskID>10</taskID>
            <mark>5</mark>
            <status>изучение завершено</status>
        </report>
        <report>
            <studentID>1</studentID>
            <programID>1</programID>
            <courseID>6</courseID>
            <taskID>11</taskID>
            <mark>5</mark>
            <status>задание принято</status>
        </report>
        <report>
            <studentID>1</studentID>
            <programID>1</programID>
            <courseID>7</courseID>
            <taskID>12</taskID>
            <mark>5</mark>
            <status>изучение завершено</status>
        </report>
        <report>
            <studentID>1</studentID>
            <programID>1</programID>
            <courseID>7</courseID>
            <taskID>13</taskID>
            <mark>5</mark>
            <status>задание принято</status>
        </report>
        <report>
            <studentID>1</studentID>
            <programID>1</programID>
            <courseID>7</courseID>
            <taskID>14</taskID>
            <mark>5</mark>
            <status>изучение завершено</status>
        </report>
        <report>
            <studentID>1</studentID>
            <programID>1</programID>
            <courseID>8</courseID>
            <taskID>15</taskID>
            <mark>5</mark>
            <status>задание принято</status>
        </report>


        <report>
            <studentID>2</studentID>
            <programID>1</programID>
            <courseID>1</courseID>
            <taskID>1</taskID>
            <mark>5</mark>
            <status>изучение завершено</status>
        </report>
        <report>
            <studentID>2</studentID>
            <programID>1</programID>
            <courseID>2</courseID>
            <taskID>2</taskID>
            <mark>4</mark>
            <status>изучение завершено</status>
        </report>
        <report>
            <studentID>2</studentID>
            <programID>1</programID>
            <courseID>2</courseID>
            <taskID>3</taskID>
            <mark>3</mark>
            <status>задание принято</status>
        </report>
        <report>
            <studentID>2</studentID>
            <programID>1</programID>
            <courseID>3</courseID>
            <taskID>4</taskID>
            <mark>3</mark>
            <status>изучение завершено</status>
        </report>
        <report>
            <studentID>2</studentID>
            <programID>1</programID>
            <courseID>3</courseID>
            <taskID>5</taskID>
            <mark>3</mark>
            <status>задание принято</status>
        </report>
        <report>
            <studentID>2</studentID>
            <programID>1</programID>
            <courseID>4</courseID>
            <taskID>6</taskID>
            <mark>5</mark>
            <status>изучение завершено</status>
        </report>
        <report>
            <studentID>2</studentID>
            <programID>1</programID>
            <courseID>4</courseID>
            <taskID>7</taskID>
            <mark>5</mark>
            <status>задание принято</status>
        </report>
        <report>
            <studentID>2</studentID>
            <programID>1</programID>
            <courseID>5</courseID>
            <taskID>8</taskID>
            <mark>5</mark>
            <status>изучение завершено</status>
        </report>
        <report>
            <studentID>2</studentID>
            <programID>1</programID>
            <courseID>5</courseID>
            <taskID>9</taskID>
            <mark>5</mark>
            <status>задание принято</status>
        </report>
        <report>
            <studentID>2</studentID>
            <programID>1</programID>
            <courseID>6</courseID>
            <taskID>10</taskID>
            <mark>5</mark>
            <status>изучение завершено</status>
        </report>
        <report>
            <studentID>2</studentID>
            <programID>1</programID>
            <courseID>6</courseID>
            <taskID>11</taskID>
            <mark>5</mark>
            <status>задание принято</status>
        </report>
        <report>
            <studentID>2</studentID>
            <programID>1</programID>
            <courseID>7</courseID>
            <taskID>12</taskID>
            <mark>5</mark>
            <status>изучение завершено</status>
        </report>
        <report>
            <studentID>2</studentID>
            <programID>1</programID>
            <courseID>7</courseID>
            <taskID>13</taskID>
            <mark>5</mark>
            <status>задание принято</status>
        </report>
        <report>
            <studentID>2</studentID>
            <programID>1</programID>
            <courseID>7</courseID>
            <taskID>14</taskID>
            <mark>5</mark>
            <status>изучение завершено</status>
        </report>
        <report>
            <studentID>2</studentID>
            <programID>1</programID>
            <courseID>8</courseID>
            <taskID>15</taskID>
            <mark>5</mark>
            <status>задание принято</status>
        </report>


        <report>
            <studentID>3</studentID>
            <programID>2</programID>
            <courseID>4</courseID>
            <taskID>6</taskID>
            <mark>5</mark>
            <status>изучение завершено</status>
        </report>
        <report>
            <studentID>3</studentID>
            <programID>2</programID>
            <courseID>4</courseID>
            <taskID>7</taskID>
            <mark>5</mark>
            <status>задание принято</status>
        </report>
        <report>
            <studentID>3</studentID>
            <programID>2</programID>
            <courseID>5</courseID>
            <taskID>8</taskID>
            <mark>5</mark>
            <status>изучение завершено</status>
        </report>
        <report>
            <studentID>3</studentID>
            <programID>2</programID>
            <courseID>5</courseID>
            <taskID>9</taskID>
            <mark>5</mark>
            <status>задание принято</status>
        </report>


        <report>
            <studentID>4</studentID>
            <programID>3</programID>
            <courseID>1</courseID>
            <taskID>1</taskID>
            <mark>5</mark>
            <status>изучение завершено</status>
        </report>
        <report>
            <studentID>4</studentID>
            <programID>3</programID>
            <courseID>2</courseID>
            <taskID>2</taskID>
            <mark>4</mark>
            <status>изучение завершено</status>
        </report>
        <report>
            <studentID>4</studentID>
            <programID>3</programID>
            <courseID>2</courseID>
            <taskID>3</taskID>
            <mark>3</mark>
            <status>задание принято</status>
        </report>
        <report>
            <studentID>4</studentID>
            <programID>3</programID>
            <courseID>3</courseID>
            <taskID>4</taskID>
            <mark>3</mark>
            <status>изучение завершено</status>
        </report>
        <report>
            <studentID>4</studentID>
            <programID>3</programID>
            <courseID>3</courseID>
            <taskID>5</taskID>
            <mark>3</mark>
            <status>задание принято</status>
        </report>
        <report>
            <studentID>4</studentID>
            <programID>3</programID>